{
  "schema_version": "sl0024-artifact-digests-v1",
  "generated_at": "2026-08-25T00:00:00+00:00",
  "excludes_self": "ARTIFACT-DIGESTS.json",
  "digests": {
    "verification_sample.json": "sha256:e6bfa5a412658876661ee66b0ecdc66d9e7b216d7cb404984650010b10d4c645",
    "verification_sample_schema.json": "sha256:0dfee096c4a483eee71acb567258400a795bcbb3c858ba6aef1700d65b64327e",
    "verification_results.json": "sha256:e1a55da4126d630d1bf9a7c307243027b43b80b79e78de6de07ce73d47099fae",
    "verification_results_schema.json": "sha256:a2108592e2f23220ac21eaca3b0ec2107d057b351d1d7348430162e1ebabad9f",
    "REPORT.md": "sha256:df5f3a7b6450797f808c7ff9e1e50144021598a185171e87529deb7cd02f07ca"
  }
}
